<?xml version="1.0" encoding="UTF-8"?>
<!DOCTYPE behemoth SYSTEM "behemoth.dtd">
<behemoth type="white">
  <Date/>
  <DocumentN>123</DocumentN>
  <Time/>
  <Bear>
    <Address>New Zealand</Address>
    <Colour/>
  </Bear>
  <Giraffe>
    <Height/>
    <Mood>awake, aroused</Mood>
  </Giraffe>
  <Zebra>
    <ColourOne>white</ColourOne>
    <ColourTwo>black</ColourTwo>
    <Name/>
  </Zebra>
</behemoth>
